{"verdict":"pass","summary":"マージを止めるバグ、セキュリティ、データ整合性上の問題は見つかりませんでした。event_group 撤去は schema / UI / Server Action / seed / truncate / migration まで概ね整合しており、edition 基盤追加も Drizzle schema と migration snapshot の差分は揃っています。web/shared/api の型チェックは通過しました。","blockers":[],"should_fix":[],"nits":[{"file":"apps/web/src/components/events/event-form.test.tsx","line":26,"line_end":115,"title":"JSX props が同一行に詰まっている","rationale":"`action={noop}        cancelHref=...` のように props が不自然に同一行へ詰まっており、差分確認時の可読性が落ちています。動作や型安全性には影響しないため nit です。","suggestion":"Prettier/formatter を通して、各 prop を通常の複数行 JSX 形式に戻してください。"},{"file":"apps/web/src/app/(app)/admin/mail-inbox/components/ApprovalForm.test.tsx","line":62,"line_end":346,"title":"JSX props が同一行に詰まっている","rationale":"`registeredUnitKeys={[]}        action={noop}` のような整形崩れが複数箇所にあります。構文としては有効ですが、テスト修正の意図が読み取りづらくなっています。","suggestion":"Prettier/formatter を通して、`registeredUnitKeys` と `action` を別行に整形してください。"}],"good_points":["event_groups の参照削除範囲が広く、API・Web・shared schema・test-utils まで一貫しています。","0032_drop_event_groups.sql は FK/column/table の drop 順と IF EXISTS が考慮されており、再実行や部分適用に強い形です。"]}